<?xml version="1.0"?>

<network xmlns:xsi="http://www.w3.org/2001/XMLSchema-instance"
    xmlns="https://4043094.github.io/xml"
    xsi:schemaLocation="https://4043094.github.io/xml network.xsd">
    <router>
        <name>Fios by Verizon</name>
        <model>Fios-G1100</model>
        <login>
            <ip-address>192.168.1.1</ip-address>
            <password>tan788work</password>
        </login>
    </router>
    <devices>
        <device>
            <name>raspi</name>
            <software>Raspberry Pi OS</software>
            <login>
                <ip-address>192.168.1.211</ip-address>
                <user>mypi</user>
                <password>ThisIsMyPi</password>
            </login>
        </device>
        <device>
            <name>raspi-2</name>
            <software>Raspberry Pi OS</software>
            <runs>Pi-hole</runs>
            <login>
                <ip-address>192.168.1.3</ip-address>
                <user>mypi</user>
                <password>ThisIsMyPi</password>
            </login>
        </device>
    </devices>
</network>